<?xml version="1.0" encoding="UTF-8"?>
<xs:schema xmlns:xs="http://www.w3.org/2001/XMLSchema">
  <xs:element name="company">
    <xs:complexType>
      <xs:sequence>
        <xs:element name="employee" maxOccurs="unbounded">
          <xs:complexType>
            <xs:sequence>
              <xs:element name="id" type="xs:string"/>
              <xs:element name="name">
                <xs:complexType>
                  <xs:sequence>
                    <xs:element name="first" type="xs:string"/>
                    <xs:element name="last" type="xs:string"/>
                  </xs:sequence>
                </xs:complexType>
              </xs:element>
              <xs:element name="department" type="xs:string"/>
              <xs:element name="salary" type="xs:decimal"/>
            </xs:sequence>
          </xs:complexType>
        </xs:element>
      </xs:sequence>
    </xs:complexType>
  </xs:element>
</xs:schema>